{
  "by_metric": {
    "ap": {
      "artifact_exact_rate": 0.0,
      "fn": 73,
      "fp": 0,
      "precision": 1.0,
      "precision_wilson_95": [
        1.0,
        1.0
      ],
      "recall": 0.0,
      "recall_wilson_95": [
        0.0,
        0.04999375338358389
      ],
      "tp": 0
    },
    "ap50": {
      "artifact_exact_rate": 1.0,
      "fn": 0,
      "fp": 0,
      "precision": 1.0,
      "precision_wilson_95": [
        0.7008472464490407,
        1.0
      ],
      "recall": 1.0,
      "recall_wilson_95": [
        0.7008472464490407,
        1.0
      ],
      "tp": 9
    },
    "ap75": {
      "artifact_exact_rate": 1.0,
      "fn": 0,
      "fp": 0,
      "precision": 1.0,
      "precision_wilson_95": [
        0.7008472464490407,
        1.0
      ],
      "recall": 1.0,
      "recall_wilson_95": [
        0.7008472464490407,
        1.0
      ],
      "tp": 9
    },
    "ar": {
      "artifact_exact_rate": 0.0,
      "fn": 15,
      "fp": 0,
      "precision": 1.0,
      "precision_wilson_95": [
        1.0,
        1.0
      ],
      "recall": 0.0,
      "recall_wilson_95": [
        0.0,
        0.20388926630434784
      ],
      "tp": 0
    },
    "box_ap": {
      "artifact_exact_rate": 0.0,
      "fn": 602,
      "fp": 0,
      "precision": 1.0,
      "precision_wilson_95": [
        1.0,
        1.0
      ],
      "recall": 0.0,
      "recall_wilson_95": [
        0.0,
        0.006340931358955872
      ],
      "tp": 0
    },
    "box_ap50": {
      "artifact_exact_rate": 0.0,
      "fn": 7,
      "fp": 0,
      "precision": 1.0,
      "precision_wilson_95": [
        1.0,
        1.0
      ],
      "recall": 0.0,
      "recall_wilson_95": [
        0.0,
        0.35433884297520657
      ],
      "tp": 0
    },
    "keypoint_ap": {
      "artifact_exact_rate": 0.0,
      "fn": 4,
      "fp": 0,
      "precision": 1.0,
      "precision_wilson_95": [
        1.0,
        1.0
      ],
      "recall": 0.0,
      "recall_wilson_95": [
        0.0,
        0.48990002040399916
      ],
      "tp": 0
    },
    "mask_ap": {
      "artifact_exact_rate": 0.0,
      "fn": 272,
      "fp": 0,
      "precision": 1.0,
      "precision_wilson_95": [
        1.0,
        1.0
      ],
      "recall": 0.0,
      "recall_wilson_95": [
        0.0,
        0.013926833371036128
      ],
      "tp": 0
    },
    "pq": {
      "artifact_exact_rate": 0.0,
      "fn": 13,
      "fp": 0,
      "precision": 1.0,
      "precision_wilson_95": [
        1.0,
        1.0
      ],
      "recall": 0.0,
      "recall_wilson_95": [
        0.0,
        0.22810184305529166
      ],
      "tp": 0
    },
    "proposal_ar": {
      "artifact_exact_rate": 0.0,
      "fn": 2,
      "fp": 0,
      "precision": 1.0,
      "precision_wilson_95": [
        1.0,
        1.0
      ],
      "recall": 0.0,
      "recall_wilson_95": [
        0.0,
        0.6576280471103807
      ],
      "tp": 0
    }
  },
  "by_repository": {
    "detectron2": {
      "artifact_exact_rate": 0.0,
      "fn": 117,
      "fp": 0,
      "precision": 1.0,
      "precision_wilson_95": [
        1.0,
        1.0
      ],
      "recall": 0.0,
      "recall_wilson_95": [
        0.0,
        0.03179037682387522
      ],
      "tp": 0
    },
    "mmdetection": {
      "artifact_exact_rate": 0.23008849557522124,
      "fn": 871,
      "fp": 0,
      "precision": 1.0,
      "precision_wilson_95": [
        0.8241154494176252,
        1.0
      ],
      "recall": 0.020247469066366704,
      "recall_wilson_95": [
        0.012845155017161412,
        0.031778213786442716
      ],
      "tp": 18
    }
  },
  "cases": [
    {
      "exact": false,
      "expected_claims": 117,
      "extracted_scoped_claims": 0,
      "fn": 117,
      "fp": 0,
      "local_path": "detectron2/MODEL_ZOO.md",
      "repository": "detectron2",
      "tp": 0
    },
    {
      "exact": false,
      "expected_claims": 2,
      "extracted_scoped_claims": 0,
      "fn": 2,
      "fp": 0,
      "local_path": "mmdetection/configs/albu_example/README.md",
      "repository": "mmdetection",
      "tp": 0
    },
    {
      "exact": false,
      "expected_claims": 2,
      "extracted_scoped_claims": 0,
      "fn": 2,
      "fp": 0,
      "local_path": "mmdetection/configs/atss/README.md",
      "repository": "mmdetection",
      "tp": 0
    },
    {
      "exact": false,
      "expected_claims": 1,
      "extracted_scoped_claims": 0,
      "fn": 1,
      "fp": 0,
      "local_path": "mmdetection/configs/autoassign/README.md",
      "repository": "mmdetection",
      "tp": 0
    },
    {
      "exact": false,
      "expected_claims": 4,
      "extracted_scoped_claims": 0,
      "fn": 4,
      "fp": 0,
      "local_path": "mmdetection/configs/boxinst/README.md",
      "repository": "mmdetection",
      "tp": 0
    },
    {
      "exact": true,
      "expected_claims": 0,
      "extracted_scoped_claims": 0,
      "fn": 0,
      "fp": 0,
      "local_path": "mmdetection/configs/bytetrack/README.md",
      "repository": "mmdetection",
      "tp": 0
    },
    {
      "exact": false,
      "expected_claims": 4,
      "extracted_scoped_claims": 0,
      "fn": 4,
      "fp": 0,
      "local_path": "mmdetection/configs/carafe/README.md",
      "repository": "mmdetection",
      "tp": 0
    },
    {
      "exact": false,
      "expected_claims": 44,
      "extracted_scoped_claims": 0,
      "fn": 44,
      "fp": 0,
      "local_path": "mmdetection/configs/cascade_rcnn/README.md",
      "repository": "mmdetection",
      "tp": 0
    },
    {
      "exact": false,
      "expected_claims": 3,
      "extracted_scoped_claims": 0,
      "fn": 3,
      "fp": 0,
      "local_path": "mmdetection/configs/cascade_rpn/README.md",
      "repository": "mmdetection",
      "tp": 0
    },
    {
      "exact": false,
      "expected_claims": 1,
      "extracted_scoped_claims": 0,
      "fn": 1,
      "fp": 0,
      "local_path": "mmdetection/configs/centernet/README.md",
      "repository": "mmdetection",
      "tp": 0
    },
    {
      "exact": false,
      "expected_claims": 1,
      "extracted_scoped_claims": 0,
      "fn": 1,
      "fp": 0,
      "local_path": "mmdetection/configs/centripetalnet/README.md",
      "repository": "mmdetection",
      "tp": 0
    },
    {
      "exact": false,
      "expected_claims": 3,
      "extracted_scoped_claims": 0,
      "fn": 3,
      "fp": 0,
      "local_path": "mmdetection/configs/cityscapes/README.md",
      "repository": "mmdetection",
      "tp": 0
    },
    {
      "exact": false,
      "expected_claims": 2,
      "extracted_scoped_claims": 0,
      "fn": 2,
      "fp": 0,
      "local_path": "mmdetection/configs/condinst/README.md",
      "repository": "mmdetection",
      "tp": 0
    },
    {
      "exact": false,
      "expected_claims": 1,
      "extracted_scoped_claims": 0,
      "fn": 1,
      "fp": 0,
      "local_path": "mmdetection/configs/conditional_detr/README.md",
      "repository": "mmdetection",
      "tp": 0
    },
    {
      "exact": true,
      "expected_claims": 0,
      "extracted_scoped_claims": 0,
      "fn": 0,
      "fp": 0,
      "local_path": "mmdetection/configs/convnext/README.md",
      "repository": "mmdetection",
      "tp": 0
    },
    {
      "exact": false,
      "expected_claims": 3,
      "extracted_scoped_claims": 0,
      "fn": 3,
      "fp": 0,
      "local_path": "mmdetection/configs/cornernet/README.md",
      "repository": "mmdetection",
      "tp": 0
    },
    {
      "exact": false,
      "expected_claims": 2,
      "extracted_scoped_claims": 0,
      "fn": 2,
      "fp": 0,
      "local_path": "mmdetection/configs/crowddet/README.md",
      "repository": "mmdetection",
      "tp": 0
    },
    {
      "exact": false,
      "expected_claims": 1,
      "extracted_scoped_claims": 0,
      "fn": 1,
      "fp": 0,
      "local_path": "mmdetection/configs/dab_detr/README.md",
      "repository": "mmdetection",
      "tp": 0
    },
    {
      "exact": false,
      "expected_claims": 18,
      "extracted_scoped_claims": 0,
      "fn": 18,
      "fp": 0,
      "local_path": "mmdetection/configs/dcn/README.md",
      "repository": "mmdetection",
      "tp": 0
    },
    {
      "exact": false,
      "expected_claims": 7,
      "extracted_scoped_claims": 0,
      "fn": 7,
      "fp": 0,
      "local_path": "mmdetection/configs/dcnv2/README.md",
      "repository": "mmdetection",
      "tp": 0
    },
    {
      "exact": false,
      "expected_claims": 1,
      "extracted_scoped_claims": 0,
      "fn": 1,
      "fp": 0,
      "local_path": "mmdetection/configs/ddod/README.md",
      "repository": "mmdetection",
      "tp": 0
    },
    {
      "exact": false,
      "expected_claims": 3,
      "extracted_scoped_claims": 0,
      "fn": 3,
      "fp": 0,
      "local_path": "mmdetection/configs/ddq/README.md",
      "repository": "mmdetection",
      "tp": 0
    },
    {
      "exact": true,
      "expected_claims": 0,
      "extracted_scoped_claims": 0,
      "fn": 0,
      "fp": 0,
      "local_path": "mmdetection/configs/deepfashion/README.md",
      "repository": "mmdetection",
      "tp": 0
    },
    {
      "exact": true,
      "expected_claims": 0,
      "extracted_scoped_claims": 0,
      "fn": 0,
      "fp": 0,
      "local_path": "mmdetection/configs/deepsort/README.md",
      "repository": "mmdetection",
      "tp": 0
    },
    {
      "exact": false,
      "expected_claims": 3,
      "extracted_scoped_claims": 0,
      "fn": 3,
      "fp": 0,
      "local_path": "mmdetection/configs/deformable_detr/README.md",
      "repository": "mmdetection",
      "tp": 0
    },
    {
      "exact": false,
      "expected_claims": 11,
      "extracted_scoped_claims": 0,
      "fn": 11,
      "fp": 0,
      "local_path": "mmdetection/configs/detectors/README.md",
      "repository": "mmdetection",
      "tp": 0
    },
    {
      "exact": false,
      "expected_claims": 1,
      "extracted_scoped_claims": 0,
      "fn": 1,